{
 "schema_version": "1.0",
 "run": {
  "run_id": "run_fixture_r1",
  "generation": "GFIXTUR",
  "started_at": 980.0,
  "read_interval_s": 5,
  "poll_cap_s": 60,
  "n_consecutive": 2,
  "systems": [
   {
    "id": "setup0",
    "label": "SharePoint",
    "config_label": "fixture config zero"
   },
   {
    "id": "setup_a_basic",
    "label": "Azure AI Search",
    "config_label": "fixture config a"
   },
   {
    "id": "setup_b",
    "label": "Revocation layer",
    "config_label": "fixture config b"
   }
  ],
  "personas": [
   {
    "id": "p-a",
    "display": "Ada Fixture"
   },
   {
    "id": "p-b",
    "display": "Bo Fixture"
   }
  ]
 },
 "scenario": {
  "id": "S-fixture",
  "description": "fixture scenario",
  "replicate": 1,
  "baseline_target_s": 10,
  "tracked_pairs": [
   {
    "persona": "p-a",
    "canary": "CANARY-FLIP",
    "doc_label": "Fixture/doc-a.txt",
    "role": "flipped"
   },
   {
    "persona": "p-b",
    "canary": "CANARY-CTRL",
    "doc_label": "Fixture/doc-b.txt",
    "role": "control"
   }
  ]
 },
 "events": [
  {
   "type": "read",
   "t": 990.0,
   "t_rel_s": -10.0,
   "phase": "baseline",
   "system": "setup0",
   "persona": "p-a",
   "canary": "CANARY-FLIP",
   "outcome": "served",
   "status_code": 200,
   "error_kind": null,
   "expected": "allow",
   "verdict": "ok"
  },
  {
   "type": "read",
   "t": 990.0,
   "t_rel_s": -10.0,
   "phase": "baseline",
   "system": "setup0",
   "persona": "p-b",
   "canary": "CANARY-CTRL",
   "outcome": "served",
   "status_code": 200,
   "error_kind": null,
   "expected": "allow",
   "verdict": "ok"
  },
  {
   "type": "read",
   "t": 990.0,
   "t_rel_s": -10.0,
   "phase": "baseline",
   "system": "setup_a_basic",
   "persona": "p-a",
   "canary": "CANARY-FLIP",
   "outcome": "served",
   "status_code": 200,
   "error_kind": null,
   "expected": "allow",
   "verdict": "ok"
  },
  {
   "type": "read",
   "t": 990.0,
   "t_rel_s": -10.0,
   "phase": "baseline",
   "system": "setup_a_basic",
   "persona": "p-b",
   "canary": "CANARY-CTRL",
   "outcome": "served",
   "status_code": 200,
   "error_kind": null,
   "expected": "allow",
   "verdict": "ok"
  },
  {
   "type": "read",
   "t": 990.0,
   "t_rel_s": -10.0,
   "phase": "baseline",
   "system": "setup_b",
   "persona": "p-a",
   "canary": "CANARY-FLIP",
   "outcome": "served",
   "status_code": 200,
   "error_kind": null,
   "expected": "allow",
   "verdict": "ok"
  },
  {
   "type": "read",
   "t": 990.0,
   "t_rel_s": -10.0,
   "phase": "baseline",
   "system": "setup_b",
   "persona": "p-b",
   "canary": "CANARY-CTRL",
   "outcome": "served",
   "status_code": 200,
   "error_kind": null,
   "expected": "allow",
   "verdict": "ok"
  },
  {
   "type": "read",
   "t": 995.0,
   "t_rel_s": -5.0,
   "phase": "baseline",
   "system": "setup0",
   "persona": "p-a",
   "canary": "CANARY-FLIP",
   "outcome": "served",
   "status_code": 200,
   "error_kind": null,
   "expected": "allow",
   "verdict": "ok"
  },
  {
   "type": "read",
   "t": 995.0,
   "t_rel_s": -5.0,
   "phase": "baseline",
   "system": "setup0",
   "persona": "p-b",
   "canary": "CANARY-CTRL",
   "outcome": "served",
   "status_code": 200,
   "error_kind": null,
   "expected": "allow",
   "verdict": "ok"
  },
  {
   "type": "read",
   "t": 995.0,
   "t_rel_s": -5.0,
   "phase": "baseline",
   "system": "setup_a_basic",
   "persona": "p-a",
   "canary": "CANARY-FLIP",
   "outcome": "served",
   "status_code": 200,
   "error_kind": null,
   "expected": "allow",
   "verdict": "ok"
  },
  {
   "type": "read",
   "t": 995.0,
   "t_rel_s": -5.0,
   "phase": "baseline",
   "system": "setup_a_basic",
   "persona": "p-b",
   "canary": "CANARY-CTRL",
   "outcome": "served",
   "status_code": 200,
   "error_kind": null,
   "expected": "allow",
   "verdict": "ok"
  },
  {
   "type": "read",
   "t": 995.0,
   "t_rel_s": -5.0,
   "phase": "baseline",
   "system": "setup_b",
   "persona": "p-a",
   "canary": "CANARY-FLIP",
   "outcome": "served",
   "status_code": 200,
   "error_kind": null,
   "expected": "allow",
   "verdict": "ok"
  },
  {
   "type": "read",
   "t": 995.0,
   "t_rel_s": -5.0,
   "phase": "baseline",
   "system": "setup_b",
   "persona": "p-b",
   "canary": "CANARY-CTRL",
   "outcome": "served",
   "status_code": 200,
   "error_kind": null,
   "expected": "allow",
   "verdict": "ok"
  },
  {
   "type": "indexer_run",
   "t": 997.0,
   "t_rel_s": -3,
   "system": "setup_a_basic",
   "index": "fixture-index",
   "t_start": 997.0,
   "t_end": 1002.0,
   "status": "success",
   "items_processed": 3
  },
  {
   "type": "read",
   "t": 1000.0,
   "t_rel_s": 0.0,
   "phase": "poll",
   "system": "setup0",
   "persona": "p-a",
   "canary": "CANARY-FLIP",
   "outcome": "served",
   "status_code": 200,
   "error_kind": null,
   "expected": "deny",
   "verdict": "leak"
  },
  {
   "type": "read",
   "t": 1000.0,
   "t_rel_s": 0.0,
   "phase": "poll",
   "system": "setup0",
   "persona": "p-b",
   "canary": "CANARY-CTRL",
   "outcome": "served",
   "status_code": 200,
   "error_kind": null,
   "expected": "allow",
   "verdict": "ok"
  },
  {
   "type": "read",
   "t": 1000.0,
   "t_rel_s": 0.0,
   "phase": "poll",
   "system": "setup_a_basic",
   "persona": "p-a",
   "canary": "CANARY-FLIP",
   "outcome": "served",
   "status_code": 200,
   "error_kind": null,
   "expected": "deny",
   "verdict": "leak"
  },
  {
   "type": "read",
   "t": 1000.0,
   "t_rel_s": 0.0,
   "phase": "poll",
   "system": "setup_a_basic",
   "persona": "p-b",
   "canary": "CANARY-CTRL",
   "outcome": "served",
   "status_code": 200,
   "error_kind": null,
   "expected": "allow",
   "verdict": "ok"
  },
  {
   "type": "read",
   "t": 1000.0,
   "t_rel_s": 0.0,
   "phase": "poll",
   "system": "setup_b",
   "persona": "p-a",
   "canary": "CANARY-FLIP",
   "outcome": "not_indexed",
   "status_code": null,
   "error_kind": null,
   "expected": "deny",
   "verdict": "unscored"
  },
  {
   "type": "read",
   "t": 1000.0,
   "t_rel_s": 0.0,
   "phase": "poll",
   "system": "setup_b",
   "persona": "p-b",
   "canary": "CANARY-CTRL",
   "outcome": "served",
   "status_code": 200,
   "error_kind": null,
   "expected": "allow",
   "verdict": "ok"
  },
  {
   "type": "mutation",
   "t": 1000.0,
   "t_rel_s": 0,
   "t_requested": 999.0,
   "t_confirmed": 1000.0,
   "mutation_type": "grant_removed",
   "summary": "fixture mutation text"
  },
  {
   "type": "read",
   "t": 1005.0,
   "t_rel_s": 5.0,
   "phase": "poll",
   "system": "setup0",
   "persona": "p-a",
   "canary": "CANARY-FLIP",
   "outcome": "served",
   "status_code": 200,
   "error_kind": null,
   "expected": "deny",
   "verdict": "leak"
  },
  {
   "type": "read",
   "t": 1005.0,
   "t_rel_s": 5.0,
   "phase": "poll",
   "system": "setup0",
   "persona": "p-b",
   "canary": "CANARY-CTRL",
   "outcome": "served",
   "status_code": 200,
   "error_kind": null,
   "expected": "allow",
   "verdict": "ok"
  },
  {
   "type": "read",
   "t": 1005.0,
   "t_rel_s": 5.0,
   "phase": "poll",
   "system": "setup_a_basic",
   "persona": "p-a",
   "canary": "CANARY-FLIP",
   "outcome": "served",
   "status_code": 200,
   "error_kind": null,
   "expected": "deny",
   "verdict": "leak"
  },
  {
   "type": "read",
   "t": 1005.0,
   "t_rel_s": 5.0,
   "phase": "poll",
   "system": "setup_a_basic",
   "persona": "p-b",
   "canary": "CANARY-CTRL",
   "outcome": "served",
   "status_code": 200,
   "error_kind": null,
   "expected": "allow",
   "verdict": "ok"
  },
  {
   "type": "read",
   "t": 1005.0,
   "t_rel_s": 5.0,
   "phase": "poll",
   "system": "setup_b",
   "persona": "p-a",
   "canary": "CANARY-FLIP",
   "outcome": "denied",
   "status_code": null,
   "error_kind": null,
   "expected": "deny",
   "verdict": "ok"
  },
  {
   "type": "read",
   "t": 1005.0,
   "t_rel_s": 5.0,
   "phase": "poll",
   "system": "setup_b",
   "persona": "p-b",
   "canary": "CANARY-CTRL",
   "outcome": "served",
   "status_code": 200,
   "error_kind": null,
   "expected": "allow",
   "verdict": "ok"
  },
  {
   "type": "phase",
   "t": 1005.0,
   "t_rel_s": 5.0,
   "name": "first_deny",
   "system": "setup_b",
   "detail": null
  },
  {
   "type": "read",
   "t": 1010.0,
   "t_rel_s": 10.0,
   "phase": "poll",
   "system": "setup0",
   "persona": "p-a",
   "canary": "CANARY-FLIP",
   "outcome": "served",
   "status_code": 200,
   "error_kind": null,
   "expected": "deny",
   "verdict": "leak"
  },
  {
   "type": "read",
   "t": 1010.0,
   "t_rel_s": 10.0,
   "phase": "poll",
   "system": "setup0",
   "persona": "p-b",
   "canary": "CANARY-CTRL",
   "outcome": "served",
   "status_code": 200,
   "error_kind": null,
   "expected": "allow",
   "verdict": "ok"
  },
  {
   "type": "read",
   "t": 1010.0,
   "t_rel_s": 10.0,
   "phase": "poll",
   "system": "setup_a_basic",
   "persona": "p-a",
   "canary": "CANARY-FLIP",
   "outcome": "error",
   "status_code": null,
   "error_kind": null,
   "expected": "deny",
   "verdict": "unscored"
  },
  {
   "type": "read",
   "t": 1010.0,
   "t_rel_s": 10.0,
   "phase": "poll",
   "system": "setup_a_basic",
   "persona": "p-b",
   "canary": "CANARY-CTRL",
   "outcome": "served",
   "status_code": 200,
   "error_kind": null,
   "expected": "allow",
   "verdict": "ok"
  },
  {
   "type": "read",
   "t": 1010.0,
   "t_rel_s": 10.0,
   "phase": "poll",
   "system": "setup_b",
   "persona": "p-a",
   "canary": "CANARY-FLIP",
   "outcome": "denied",
   "status_code": null,
   "error_kind": null,
   "expected": "deny",
   "verdict": "ok"
  },
  {
   "type": "read",
   "t": 1010.0,
   "t_rel_s": 10.0,
   "phase": "poll",
   "system": "setup_b",
   "persona": "p-b",
   "canary": "CANARY-CTRL",
   "outcome": "served",
   "status_code": 200,
   "error_kind": null,
   "expected": "allow",
   "verdict": "ok"
  },
  {
   "type": "read",
   "t": 1020.0,
   "t_rel_s": 20.0,
   "phase": "poll",
   "system": "setup0",
   "persona": "p-a",
   "canary": "CANARY-FLIP",
   "outcome": "served",
   "status_code": 200,